{
  "$schema": "../schemas/example.schema.json",
  "example_count": 1,
  "examples": [
    {
      "title": "Add an HTML-formatted note",
      "code": "# Add a note to the Node Graph.\nnote = nuke.createNode(\"StickyNote\")\nnote[\"label\"].setValue(\"<b>Review:</b> Check edge treatment\")",
      "kind": "source_backed_editorial",
      "confidence": "source_backed_draft",
      "provenance": {
        "source_type": "official_foundry_research_pass1",
        "source_ids": [
          "foundry_sticky"
        ],
        "editorial_note": ""
      }
    }
  ],
  "kind": "nuke_node_examples",
  "node": {
    "category": "Other",
    "class": "StickyNote",
    "display_name": "StickyNote",
    "id": "node:StickyNote",
    "menu_path": "Other/StickyNote"
  },
  "provenance": {
    "examples_dataset": "Nuke Reference Examples v1",
    "nuke_version": {
      "major": 17,
      "minor": 0,
      "release": 3,
      "string": "17.0v3"
    },
    "reference_schema_version": "1.0.0"
  },
  "research_flags": [],
  "schema_version": "1.0.0",
  "status": "COMPLETE",
  "status_reason": "Source-backed editorial example(s) added from Foundry research pass 1."
}